Title,Lyrics
Back At Your Door,"From the moment the lights went off
Everything had changed
Lie awake in an empty room
In my head, it all feels the same
Like the taste of the day you left
It still lingers on my breath
And the dampness of tears that left
That stain where you had wept
All alone with the negligee
That still hangs off of my bed
I keep meaning to give it away
But I just leave it there instead
No need to cry about it
I cannot live without it
Every time I wind up back at your door
Why do you do this to me?
You penetrate right through me
Every time I wind up back at your door
Three more days 'til I see your face
I'm afraid, it's far too much
Cook a meal and fix up the place
Dial your number, hang it up
If I took you for granted
I apologize for acting tough
You're my reason for living
And there's no way I'm giving up
No need to cry about it
I cannot live without it
Every time I wind up back at your door
Why do you do this to me?
You penetrate right through me
Every time I wind up back at your door
Now every evening is a bitter fight
And I'm eating all alone on a Friday night
And I know what your friends say
?He?s just wasting your love and time?
I will never let you change your mind
No need to cry about it
I cannot live without it
Every time I wind up back at your door
Why do you do this to me?
You penetrate right through me
Every time I wind up back at your door
No need to cry about it
I may just die without it
Every time I wind up back at your door
Why do you do this to me?
You penetrate right through me
Every time I wind up back at your door
Every time I wind up  back at your door
Every time I wind up back at your door"
Can't Stop,"All alone in my room, think of you
At a rate that is truly alarming
I keep looping my memories of you in my head
I pretend that you want me
And I fall asleep
And dream of alternate realities
And I put myself at ease
By pretending that she still loves me
And I can't stop thinking about you
And I can't stop thinking about you
And you never could or would do what I do
And I can't stop thinking about your love
Can't believe I could think that she would
Just follow me everywhere I go
I just wrestle with you in my dreams
And wake up making love to a pillow
And I fall asleep
And dream of alternate realities
And I put myself at ease
By pretending that she still loves me
And I can't stop thinking about you
And I can't stop thinking about you
You never could or would do what I do
And I can't stop and I can't stop
What I would give to have you look in my direction?
And I'd give my life to somehow attract your attention
And I touch myself like it's somebody else
Thoughts of you attached to, on my mind, let me show you
I can't stop thinking about you
And I can't stop thinking about you
And you never could or would do what I do
And I can't stop thinking about you
And I can't stop thinking about you
I can't stop thinking about you
And you never could or would do what I do
I can't stop thinking about you"
Kiwi,"You're such a flirt, I know you hurt
And so do I, I empathize
I see you out, you never cared
A conversation that we never shared
But it's so strange, it's something new
Amazing feelings that I have for you
I close my eyes when I'm alone
Wonder what it'd be like to make you moan
I wanna give you something better
Than anything you've ever had
A stronger and a faster lover
The world, it disappears so fast
Sweet kiwi
Your juices dripping down my chin
So please, let me
Don't stop it before it begins
So give it up and don't pretend
And spread your arms and legs across the bed
And when you shake, you won't regret
The things I whisper in your ear
(What?)
I said
I wanna give you something better
(You wanna give me something better)
Anything you've ever had
(Than anything I've ever had)
A stronger and a faster lover
(A stronger and a faster lover)
The world, it disappears so fast
(It disappears so fast)
Sweet kiwi
Your juices dripping down my chin
So please, let me
Don't stop it before it begins
I can't wait to take you home
Fingers through your hair
Kisses on your back
Scratch me with your nails
Save me from myself
Show me how to care
Get everything out
Dripping everywhere
Lipstick smeared all over your face
How much longer must we wait?
Don't think that I can wait
Sweet kiwi
Your juices dripping down my chin
So please, let me
Don't stop me before it begins
Sweet kiwi
(Wanna give you something better than this)
Your juices dripping down my chin
So please, let me
(Wanna give you something better than this)
Don't stop it before it begins
Don't stop it before it begins
Don't stop it before it begins
Don't stop it before it begins
Don't stop it before it begins"
Nothing Lasts Forever,"It is so easy to see
Dysfunction between you and me
We must free up these tired souls
Before the sadness gets us both
I tried and tried to let you know
I love you but I'm letting go
It may not last but I don't know
Just don't know
If you don't know then you can't care
And I show up but you're not there
But I'm waiting and you want to
Still afraid that I will desert you
Everyday with every word whispered
We get more far away
The distance between us makes it so hard to stay
But nothing last forever but be honest, babe
It hurts but it may be the only way
A web that's warm with memories
Can heal us temporarily
The misbehaving all it makes
The ditch between us so damn deep
Built a wall around my heart
Never let it fall apart
Strangely I wish secretly
It won't fall down while I'm asleep
If you don't know then you can't care
And I show up but you're not there
But I'm waiting and you want to
Still afraid that I will desert you, babe
Everyday with every word whispered
We get more far away
The distance between us makes it so hard to stay
But nothing last forever but be honest, babe
It hurts but it may be the only way
But we have not hit the ground
Doesn't mean we're not still falling
I want so bad to pick you up
But you're still too reluctant to accept my help
What a shame
I hope you find somewhere
To place the blame
But until then the fact remains
Everyday with every word whispered
We get more far away
The distance between us makes it so hard to stay
Nothing last forever, but be honest, babe
It hurts but it may be the only way
Everyday with every word whispered
We get more far away
The distance between us makes it so hard to stay
But nothing last forever, but be honest, babe
It hurts but it may be the only way"
Won't Go Home Without You,"I asked her to stay but she wouldn't listen
And she left before I had the chance to say
The words that would mend the things that were broken
But now it's far too late she's gone away
Every night you cry yourself to sleep
Thinking why does this happen to me?
Why does every moment have to be so hard?
Hard to believe it
It's not over tonight
Just give me one more chance to make it right
I may not make it through the night
I won't go home without you
The taste of her breath, I'll never get over
And the noises that she made kept me awake
The weight of the things that remain unspoken
Built up so much, it crushed us every day
Every night you cry yourself to sleep
Thinking, why does this happen to me?
Why does every moment have to be so hard?
Hard to believe it
It's not over tonight
Just give me one more chance to make it right
I may not make it through the night
I won't go home without you
It's not over tonight
Just give me one more chance to make it right
I may not make it through the night
I won't go home without you
Of all the things I've felt I've never really showed
Perhaps the worst is that I ever let you go
I should not ever let you go
It's not over tonight
Just give me one more chance to make it right
I may not make it through the night
I won't go home without you
It's not over tonight
Just give me one more chance to make it right
I may not make it through the night
I won't go home without you
And I won't go home without you
And I won't go home without you
And I won't go home without you"
Hello,"Well I don't feel as if I know you
You take up all my time
The days are long and the nights will throw you away
'Cos the sun won't shine
Nobody ever mentions the weather to make or break your day
Nobody ever seems to remember, life is a game we play
We live in the shadows and we had the chance and threw it away
And it's never gonna be the same
'Cos the years are fallin' by like the rain
It's never gonna be the same
Until' my mind's knew, comes to my house and says
Hello
There ain't no sense in feeling lonely
They got no faith in you
But I've got a feeling, you still owe me
So wipe from your shoes
Nobody ever mentions the weather to make or break your day
Nobody ever seems to remember, the life is a game we play
We live in the shadows and we had the chance and threw it away
And it's never gonna be the same
'Cos the years are fallin' by like the rain
It's never gonna be the same
Until' my mind's knew, comes to my house and says
Hello, hello
Hello, hello, hello
Hello, hello
Hello, hello
Oh yeah"
Must Get Out,"I've been the needle and the thread
Weaving figure eights and circles round your head
I try to laugh but cry instead
Patiently wait to hear the words you've never said
Fumbling through your dresser drawer
Forgot what I was looking for
Try to guide me in the right direction
And making use of all this time
Keeping everything inside
Close my eyes and listen to you crying
I'm lifting you up, I'm letting you down
I'm dancing 'til dawn, I'm fooling around
And I'm not giving up, I'm making your love
This city's made us crazy and we must get out
And this is not goodbye she said
It is just time for me to rest my head
She does not walk, she runs instead
Down these jagged streets and into my bed
When I was fumbling through your dresser drawer
Forgot what I was looking for
Try to guide me in the right direction
Making use of all this time
Keeping everything inside
Close my eyes and listen to you crying
I'm lifting you up, I'm letting you down
I'm dancing 'til dawn, I'm fooling around
I'm not giving up, I'm making your love
This city's made us crazy and we must get out
There's only so much I can do for you
After all of the things you put me through
Oh, I'm lifting you up, I'm letting you down
I'm dancing 'til dawn, I'm fooling around
I'm not giving up, I'm making your love
This city's made us crazy and we must get out
I'm lifting you up, I'm letting you down
I'm dancing 'til dawn, I'm fooling around
I'm not giving up, I'm making your love
This city's made us crazy and we must get out
I'm lifting you up, I'm letting you down
(Whoa, whoa)
I'm dancing 'til dawn, I'm fooling around
(Whoa, whoa)
I'm not giving up, I'm making your love
(Whoa, yeah)
This city's made us crazy and we must get out"
Not Coming Home,"When you refuse me, you confuse me
What makes you think I'll let you in again?
Think again, my friend
Go on, misuse me and abuse me
I'll come out stronger in the end
Does it make you sad to find yourself alone?
Does it make you mad to find that I have grown?
I'll bet it hurts so bad to see the strength that I have shown
When you answer the door, pick up the phone
You won't find me 'cause I'm not coming home
You do not know how much this hurts me
To say these things that I don't want to say
But have to say them anyway, oh
I would do anything to end your suffering
But you would rather walk away
Does it make you sad to find yourself alone?
Does it make you mad to find that I have grown?
I'll bet it hurts so bad to see the strength that I have shown
When you answer the door, pick up the phone
You won't find me 'cause I'm not coming home, oh yeah
Does it make you sad to find yourself alone?
Does it make you mad to find that I have grown?
Does it make you sad to find yourself alone, yeah?
Does it make you mad to see that I have grown?
I'll bet it hurts so bad to see the strength that I have shown, oh
When you answer the door, pick up the phone
You wont find me 'cause I'm not coming home yeah, yeah
When you answer the door, pick up the phone
You wont find me 'cause I'm not coming home yeah, yeah
When you answer the door, pick up the phone
You wont find me 'cause I'm not coming home"
Secret,"Watch the sunrise
Say your goodbyes
Off we go
Some conversation
No contemplation
Hit the road
Car overheats
Jump out of my seat
On the side of the highway baby
Our road is long
Your hold is strong
Please don't ever let go, oh no
I know I don't know you
But I want you so bad
Everyone has a secret
Oh can they keep it
Oh no they can't
Driving fast now
Don't think I know how to go slow
Where you at now
I feel around
There you are
Cool these engines
Calm these jets
I ask you how hot can it get
And as you wipe of beads of sweat
Slowly you say, ""I'm not there yet""
I know I don't know you
But I want you so bad
Everyone has a secret
Oh can they keep it
Oh no they can't
I know I don't know you
But I want you so bad
Everyone has a secret
Oh but can they keep it
Oh no they can't"
Sweetest Goodbye,"Where you are seems to be
As far as an eternity
Outstretched arms, open heart
And if it never ends then when do we start?
I'll never leave you behind
Or treat you unkind
I know you understand, oh
And with a tear in my eye
Give me the sweetest goodbye
That I ever did receive
Pushing forward and arching back
Bring me closer to heart attack
Say goodbye and just fly away
When you've comeback, I have some thing to say, yeah
How does it feel to know you never have to be alone
When you get home, home
There must be someplace here that only you and I could go
So I can show you how I
Dream away everyday
Try so hard to disregard
The rhythm of the rain that drops
And coincides with the beating of my heart
I'll never leave you behind
Or treat you unkind
And I know you'll understand, yeah, yeah, yeah
And with a tear in my eye
Give me the sweetest goodbye
That I ever, ever, ever did receive
Pushing forward and arching back
Bring me closer to heart attack
Say goodbye and just fly away
When you'll comeback and I have some thing to say, yeah
How does it feel to know you never have to be alone
When you get home, home
There must be someplace here that only you and I could go
So I can show you how I feel, feel, feel, feel
How does it feel to know you never have to be alone
When you get home, home
There must be someplace here that only you and I could go
So I can show you how I feel
Show you how I feel
Show you how I feel
Show I, show you
Show you how I feel
There must be someplace here that only you and I could go
So I can show you how I feel"
Tangled,"I'm full of regrets for all the things
That I've done and said
And I don't know if it'll ever be okay to show
My face around here
Sometimes I wonder if I disappear
Would you ever turn your head and look
See if I'm gone 'cause I fear
There is nothing left to say to you
That you wanna hear
That you wanna know
I think I should go
The things I've done are way too shameful
Your just an innocent
Helpless victim of a spider's web
And I'm an insect
Going after anything that I can get
So you better turn your head and run
And don't look back 'cause I fear
There is nothing left to say to you
That you wanna hear
That you wanna know
I think I should go
The things I've done are way too shameful
And I've done you so wrong
Treated you bad, strung you along
Oh, shame on myself
I don't know how I got so tangled up
Ohh yeah, yeah, yeah, yeah, yeah, yeah
You better turn your head and look
See if I'm gone 'cause I fear
There is nothing left to say to you
That you wanna hear
That you wanna know
I think I should go
The things I've done are way too shameful
And I've done you so wrong
And treated you bad, strung you along
Oh, shame on myself
I don't know how I got so tangled up
Strung you along
Oh, shame on myself
I don't know how I got so tangled up"
Through With You,"Can you see me
Floating above your head
As you lay in bed
Thinking about everything
That you did not do
Cause saying I love you
Has nothing to do with meaning it
And I don't trust you
Cause every time you're here
Your intentions are unclear
I spend every hour waiting for a phone call
That I know will never come
I used to think you were the one
Now I'm sick of thinking anything at all
You ain't ever coming back to me
That's not how things were supposed to be
You take my hand just to give it back
No other lover has ever done that
Do you remember
The way we used to melt
Do you remember how it felt
When I touched you
Oh cause I remember very well
And how long has it been
Since someone you let in
Has given what I gave to you
And at night when you sleep
Do you dream I would be there
Just for a minute or two do you?
You ain't ever coming back to me
That's not how things were supposed to be
You take my hand just to give it back
No other lover has ever done that
Heartache heartache I just have so much
A simple love with a complex touch
There is nothing you can say or do
I called to let you know I'm through with you"
Wasted Years,"Slow is the memory
I can picture her standin' right in front of me
Orange blossoms crushed on concrete
I walk around with bare feet, 'cuz I know you want me
Can't remember anything
Her skin it tastes like sugar cane
And I had already gotten there before I came
My tank is empty and I know you're thirsty
But I have already tried to explain myself
It's not that I love someone else
But I can't bear to listen to your cry, yeah
I'm sick of all these wasted years
A rag for someone else's tears
I wring you out as I hang you out to dry
No, no, no, no, no, no, yeah
And I'll see you when I get back
Maybe we can get ourselves back on the right track
You touch me there because you know how much I like that
I think that we will need to relax 'cuz I know you want me
All the time and everywhere
A happy surface but the underbelly isn't there
The worst thing is that I don't even really care
The emptiness is too much to bear
But I have already tried to explain myself
It's not that I love someone else
But I can't bear to listen to your cry
I'm sick of all these wasted years
A rag for someone else's tears
I wring you out as I hang you out to
C'mon c'mon, get off the phone, please, come home
It's been so lonely since you've been gone
Your love surround me, up and down me
Be all around me, baby, I can't breathe no more
C'mon c'mon, get off the phone, please, come home
It's been so lonely since you've been gone
Your love surround me, up and down me
Be all around me, baby, I can't breathe no more
But I have already tried to explain myself
It's not that I love someone else
But I can't bear to listen to your cry
I'm sick of all these wasted years
A rag for someone else's tears
I wring you out as I hang you out to dry
Sick of all these wasted years
A rag for someone else's tears
I wring you out as I hang you out to, to, dry
To try, try to get back home
Try, you try, yeah"
Way I Was (Non-Lp Version),"Making love to a picture frame
One more time tonight
You can tell by the lines in her smile
Something is not right
Where are you hiding?
She's on the outside
I'm on the inside crying
Just another crazy boy hungry for your
Hot love, wrap yourself around me like a warm glove
The emptiness leaves me
And I feel the never need to go back
To the way I was, the way I was
I've tried and tried and tried and tried
But I've no concept of consequence
And I'm a master of self defense
Days get longer, life gets shorter
She rips me like no other
So oh, dripping from head to toe
Where are you hiding?
She's on the outside
I'm on the inside crying
Hot love, wrap yourself around me like a warm glove
The emptiness leaves me
And I feel the never need to go back
To the way I was, the way I was
Hot love, wrap yourself around me like a warm glove
The emptiness leaves me
And I feel the never need to go back
To the way I was, the way I was
And I can't make the same mistake
If you lose my love, it was yours to take
Break down your door, take a little more
When I need you around
And I'm so terrified of leaving, it's a new low
Try and pick me up again but let go
See how far I get without you
Desperately need more of your
Hot love, wrap yourself around me like a warm glove
The emptiness leaves me
And I feel the never need to go back
To the way I was, the way I was
Hot love, wrap yourself around me like a warm glove
The emptiness leaves me
And I feel the never need to go back
To the way I was, the way I was"
Towering Over Rivals,"I didn't hear what you were saying
I live on raw emotion, baby
I answer questions, never maybe
And I'm not kind if you betray me
So who the hell are you to save me?
I never would've made it, baby
If you needed love, well then ask for love
Could've given love, now I'm taking love
And it's not my fault, cause you both deserve
What's coming now, so don't say a word
Wake up call, caught you in the morning
With another one in my bed
Don't you care about me anymore?
Don't you care about me? I don't think so
Six foot tall, came without a warning
So I had to shoot him dead
He won't come around here anymore
Come around here, I don't think so
I would've bled to make you happy
You didn't need to treat me that way
And now you've beat me at my own, game
And now I found you sleeping sound
And now your love is screaming loudly
I hear a sound and hit the ground
If you needed love, well then ask for love
Could've given love, now I'm taking love
And it's not my fault, cause you both deserve
What's coming now, so don't say a word
Wake up call, caught you in the morning
With another one in my bed
Don't you care about me anymore?
Don't you care about me? I don't think so
Six foot tall, came without a warning
So I had to shoot him dead
He won't come around here anymore
Come around here, I don't feel so bad
I don't feel so bad
I don't feel so bad
I'm so sorry, darling
Did I do the wrong thing?
Oh, what was I thinking?
Is his heart still beating?
Wake up call, caught you in the morning
With another one in my bed
Don't you care about me anymore?
Don't you care about me? I don't think so
Six foot tall, came without a warning
So I had to shoot him dead
He won't come around here anymore
Come around here, I don't feel so bad
Wake up call, caught you in the morning
With another one in my bed
Don't you care about me anymore?
Don't you care about me? I don't think so
Six foot tall, came without a warning
So I had to shoot him dead
He won't come around here anymore
No, he won't come around here
I don't feel so bad
Don't feel so bad
Don't feel so bad"
Angel In Blue Jeans,"I saw an angel in blue jeans today
It felt as she melted all my bitterness away
You always tried so hard
To hide you'r wings behind you'r coat
So let it be
And let them free
So you can hover low
Above the ground
You look so tired
You moon beams in you'r eyes
And if I belived,
I knew you'd be the first to fly
You always tried so hard
To hide you'r wings behind you'r coat
So let it be
And let them free
So you can hover low
Above the ground
I'll find sunshine,
Sometime soon
How can I miss anything about you,
When I don't even know what you'r name is?
I feel like I know you
As well as I know the sun
So please tell me,
Where is my sunshine now?
I'll find sunshine,
Sometime soon
How can I miss anything about you,
When I don't even know what you'r name is?
I feel like I know you
As well as I know the sun
So please tell me,
Where is my sunshine now?
How can I miss anything about you,
When I don't even know what you'r name is?
I feel like I know you
As well as I know the sun
I wonder,
Where is my sunshine now?"
As Things Collide,"You have this way of dipping in and out of
Sight as things collide
Bridges burning softly in the night
And you have this way of falling in and out of
Time as it goes by
Passing silently with no goodbye
And I've spoken with all the other angels
They dont know what to do
And i agree with them whole-heartedly, I do
Tellogram came today from a friend
Saying, ""Where in the hell have you been?
Where are you goin'?""
I said, ""I dont know, does the lonliness show?
And if so does it ever end?""
And I've spoken with all the other angels
They dont know what to do
And I agree with them whole-heartedly, I do
You have this way of meaning everything and nothing to me
At the same time
Returning my hellos with goodbyes
'Cause I've spoken with all the other angels
They dont know what to do
And I agree with them whole-heartedly, I do...
'Cause I've spoken with all the other angels
They dont know what to do
And I agree with them whole-heartedly, I do...
And I've spoken with all the other angels
They dont know what to do
And I agree with them whole-heartedly, I do"
Control Myself,"I have told all of my enemies
Very politely to go home
I have seen all of your remedies
Now won't you let me please go home?
I can't find anything to be sad about
They say I'm doomed but I feel fine
I have tried so very hard as hell
To stay away from hell and live upstairs
But when I see all of your remedies
I try quite desperately to go home
I can't find anything to be sad about
They say I'm doomed but I feel fine
But if I'm sitting here lonely
With no one to hold me
At least I'll have my health
I'm trying to control myself
I have told all of my enemies
Very politely to go home
I have seen all of your remedies
Now won't you let me please go home?
I've been acting irresponsibly
But what could possibly go wrong?
I have choked on all your remedies
Now won't you let me please go home?
But if I sit here lonely
With no one to hold me
At least I'll have my health
I'm trying to control myself
I'm trying to control
Myself"
